<zahtev xmlns="http://www.ftn.uns.ac.rs/xwt" xmlns:xsi="http://www.w3.org/2001/XMLSchema-instance" xsi:schemaLocation="http://www.ftn.uns.ac.rs/xwt ZH-1.xsd">
    <naziv/>
    <zavod>
        <naziv/>
        <adresa>
            <ulica>Rumenacki put</ulica>
            <broj>125</broj>
            <postanski_broj>21000</postanski_broj>
            <mesto>Novi Sad</mesto>
            <drzava>Srbija</drzava>
        </adresa>
    </zavod>
    <podnosilac xsi:type="TFizickoLice">
        <adresa>
            <ulica>Pancevacka</ulica>
            <broj>1</broj>
            <postanski_broj>21000</postanski_broj>
            <mesto>Novi Sad</mesto>
            <drzava>Srbija</drzava>
        </adresa>
        <kontakt>
            <telefon>061444999</telefon>
            <email>darkomitrovic@gmail.com</email>
            <fax>324</fax>
        </kontakt>
        <ime>Darko</ime>
        <prezime>Mitrovic</prezime>
    </podnosilac>
    <punomocnik xsi:type="TFizickoLice">
        <adresa>
            <ulica>Brace Ribnikar</ulica>
            <broj>21</broj>
            <postanski_broj>21000</postanski_broj>
            <mesto>Novi Sad</mesto>
            <drzava>Srbija</drzava>
        </adresa>
        <kontakt>
            <telefon>065222333</telefon>
            <email>predragantonic@gmail.com</email>
            <fax>3412</fax>
        </kontakt>
        <ime>Predrag</ime>
        <prezime>Antonic</prezime>
    </punomocnik>
    <zig>
        <tip_ziga>individualni_zig</tip_ziga>
        <znak>
            <tip_znaka>graficki_znak</tip_znaka>
            <izgled_znaka/>
            <boje>
                <boja>crna</boja>
                <boja>zelena</boja>
            </boje>
            <opis_znaka>lep</opis_znaka>
        </znak>
        <brojevi_klasa_robe>
            <broj>1</broj>
            <broj>25</broj>
        </brojevi_klasa_robe>
        <zatrazeno_pravo>gdsa</zatrazeno_pravo>
        <broj_prijave_ziga>1</broj_prijave_ziga>
        <datum_podnosenja>2020-10-10</datum_podnosenja>
    </zig>
    <placene_takse>
        <taksa>
            <tip_takse>osnovna_taksa</tip_takse>
            <iznos>4000</iznos>
        </taksa>
        <taksa>
            <tip_takse>za_graficko_resenje</tip_takse>
            <iznos>2000</iznos>
        </taksa>
    </placene_takse>
    <prilozi>
        <primerak_znaka/>
        <spisak_robe_i_usluga/>
        <punomocje/>
        <generalno_punomocje/>
        <punomocje_naknadno_dostavljeno/>
        <opsti_akt/>
        <dokaz_o_pravu_prvenstva/>
        <dokaz_o_uplati_takse/>
    </prilozi>
</zahtev>