<?xml version="1.0" encoding="UTF-8"?>
<zahtev xmlns="http://www.ftn.uns.ac.rs/xwt"
    xmlns:xsi="http://www.w3.org/2001/XMLSchema-instance"
    xsi:schemaLocation="http://www.ftn.uns.ac.rs/xwt ZH-1.xsd">
    <naziv></naziv>
    <zavod>
        <naziv></naziv>
        <adresa>
            <ulica></ulica>
            <broj></broj>
            <postanski_broj></postanski_broj>
            <mesto></mesto>
            <drzava></drzava>
        </adresa>
    </zavod>
    <podnosilac>
        <adresa>
            <ulica></ulica>
            <broj></broj>
            <postanski_broj></postanski_broj>
            <mesto></mesto>
            <drzava></drzava>
        </adresa>
        <kontakt>
            <telefon></telefon>
            <email></email>
        </kontakt>
    </podnosilac>
    <punomocnik>
        <adresa>
            <ulica></ulica>
            <broj></broj>
            <postanski_broj></postanski_broj>
            <mesto></mesto>
            <drzava></drzava>
        </adresa>
        <kontakt>
            <telefon></telefon>
            <email></email>
        </kontakt>
    </punomocnik>
    <zig>
        <tip_ziga></tip_ziga>
        <newElement>
            <tip_znaka></tip_znaka>
            <izgled_znaka></izgled_znaka>
            <boje></boje>
            <opis_znaka></opis_znaka>
        </newElement>
        <brojevi_klasa_robe>
            <broj></broj>
        </brojevi_klasa_robe>
        <zatrazeno_pravo></zatrazeno_pravo>
        <broj_prijave_ziga></broj_prijave_ziga>
        <datum_podnosenja></datum_podnosenja>
    </zig>
    <placene_takse></placene_takse>
    <prilozi>
        <primerak_znaka></primerak_znaka>
        <spisak_robe_i_usluga></spisak_robe_i_usluga>
        <punomocje></punomocje>
        <generalno_punomocje></generalno_punomocje>
        <punomocje_naknadno_dostavljeno></punomocje_naknadno_dostavljeno>
        <opsti_akt></opsti_akt>
        <dokaz_o_pravu_prvenstva></dokaz_o_pravu_prvenstva>
        <dokaz_o_uplati_takse></dokaz_o_uplati_takse>
    </prilozi>
</zahtev>